{
  "schema_version": "1.0",
  "incident_id": "inc_SYNTHETIC001",
  "event_id": "evt_SYNTHETIC001",
  "event_type": "runner_assistance_requested",
  "severity": "P2",
  "status": "REPORTED",
  "occurred_at": "2026-10-28T02:00:00Z",
  "recorded_at": "2026-10-28T02:00:05Z",
  "runner_id": "run_DEMO001",
  "checkpoint_id": "cp_DEMO01",
  "reported_by_role": "checkpoint_volunteer",
  "summary_code": "NEEDS_CHECK",
  "operator_note": "Synthetic training fixture only; no real runner or incident.",
  "audit": [
    {
      "action": "REPORTED",
      "actor_role": "checkpoint_volunteer",
      "at": "2026-10-28T02:00:05Z",
      "result": "accepted",
      "correlation_id": "corr_SYNTHETIC001"
    }
  ]
}
